Category,Subcategory,Product Title,Price,Rating,Reviews,Product URL
Electronics,LAPTOP,"Apple 2025 MacBook Air (13-inch, Apple M4 chip with 10-core CPU and 8-core GPU, 16GB Unified Memory, 256GB) - Sky Blue",94990,4.6,1,https://www.amazon.in/sspa/click
Electronics,LAPTOP,"ASUS TUF F16,13th Gen,Intel Core i5-13450HX,Gaming Laptop(RTX 5050-8GB/115W TGP/16GB RAM/1TB SSD/FHD+/16""/165Hz/90Whr/Windows 11/M365 Basic (1Year)*/Office Home 2024/Jaeger Gray/2.5 Kg)FX608JH-RV057WS",119990,4.3,100,https://www.amazon.in/ASUS-i5-13450HX-5050-8GB-Windows-FX608JH-RV057WS/dp/B0FB9F4LGG/ref=sr_1_3
Electronics,LAPTOP,"ASUS Vivobook 15, Smartchoice, AMD Ryzen 7 5825U, 16GB RAM, 512GB SSD, FHD 15.6"", Windows 11, Office Home 2024, Quiet Blue, 1.7Kg, M1502YA-BQ703WS, AMD Radeon iGPU, M365 Basic (1Year)*, 42Whr Laptop",49990,3.9,1,https://www.amazon.in/ASUS-Vivobook-Smartchoice-Windows-M1502YA-BQ703WS/dp/B0FC2LKFSC/ref=sr_1_4
Electronics,LAPTOP,"HP Pavilion x360, 13th Gen Intel Core i5-1335U (16GB DDR4, 1TB SSD) FHD, 14''/35.6 cm, Touchscreen 2-in-1, Win 11, Office 21, Silver, 1.51 kg, ek1010TU/1149tu, FPR, 5MP Camera, B&O, Backlit Laptop",72490,3.7,200,https://www.amazon.in/HP-Pavilion-i5-1335U-Graphics-14-ek1010TU/dp/B0BRT8BRKY/ref=sr_1_5
Electronics,LAPTOP,"Lenovo V14 Intel Core i5 13th Gen 14"" FHD (1920x1080) Antiglare 250 Nits Thin and Light Laptop (16GB RAM/512GB SSD/Windows 11 Home/Office 2024/Iron Grey/1.43 kg), 83A0A0PTIN",47990,3.6,,https://www.amazon.in/Lenovo-1920x1080-Antiglare-Windows-83A0A0PTIN/dp/B0FNS3DM56/ref=sr_1_6
Electronics,LAPTOP,"HP 15, 13th Gen Intel Core i3-1315U (12GB DDR4, 512GB SSD) FHD, Anti-Glare, Micro-Edge, 15.6''/39.6cm, Win11, M365 Basic(1yr)* Office24, Silver, 1.59kg, fd0573TU, FHD Camera w/Shutter Laptop",38490,4.0,2,https://www.amazon.in/HP-i3-1315U-Anti-Glare-Micro-Edge-fd0573TU/dp/B0F4R3GFMQ/ref=sr_1_7
Electronics,LAPTOP,"HP Smartchoice Victus, 13th Gen Intel Core i5-13420H, 4GB RTX 3050, 16GB DDR4(Upgradeable) 512GB SSD, 144Hz, 300nits, FHD, 15.6’’/39.6cm, Win11, Office24, Blue, 2.29kg, fa2190/fa2191tx Gaming Laptop",67990,3.7,500,https://www.amazon.in/HP-Smartchoice-i5-13420H-Upgradeable-Office24/dp/B0F6CVT23B/ref=sr_1_8
Electronics,LAPTOP,"HP Pro Book14[New Launch], 13th Gen Intel Core i5-1335U Turbo Boost, 24GB DDR4, 512GB SSD, Win11 Pro, MSO21, 3 Year Warranty, IPS 14"" FHD HDR Laptop, Finger Print, Backlit KB, Metal Body, Anti Virus",71250,4.5,,https://www.amazon.in/HP-Book14-i5-1335U-Warranty-Backlit/dp/B0FKN9VL6S/ref=sr_1_9
Electronics,LAPTOP,"Acer Aspire Lite, AMD Ryzen 3-5300U, 8 GB RAM, 512 GB SSD, Full HD 15.6""/39.62 cm, Windows 11 Home, Steel Gray, 1.59 KG, AL15-41, Premium Laptop",27999,3.9,500,https://www.amazon.in/Acer-Aspire-Premium-AL15-41-Display/dp/B0D37T35JP/ref=sr_1_10
Electronics,LAPTOP,"Lenovo V15 G4 AMD Athlon Silver 7120U Laptop 8GB LPDDR5 Ram, 512 GB SSD PCIe, Windows 11 Lifetime Validity,15.6"" FHD Screen, AMD Radeon 610M, Silver, 1 Year Brand Warranty",25979,4.1,200,https://www.amazon.in/Lenovo-V15-Lifetime-Validity-Warranty/dp/B0CL7CMTXS/ref=sr_1_13
Electronics,LAPTOP,"Acer Aspire 3 12th Gen Intel Core i3-1215U Premium Laptop (8GB RAM/512GB SSD/Windows 11 Home) A325-51,15.6"" Full HD IPS Display, 54Whr Battery, Silver, 1.69 Kg",29990,4.0,100,https://www.amazon.in/Acer-i3-1215U-Premium-Windows-AL15-52/dp/B0CKLN7PSZ/ref=sr_1_14
Electronics,LAPTOP,"ASUS TUF A15 (2025), AMD Ryzen 7 7445HS, Gaming Laptop(RTX 3050,75W TGP,16GB DDR5(Upgradeable Upto 64GB )512GB SSD,FHD,15.6"",144Hz,RGB Keyboard,48Whrs,Windows 11,Graphite Black,2.3 Kg) FA506NCG-HN199W",70990,4.1,1,https://www.amazon.in/ASUS-Upgradeable-Keyboard-Graphite-FA506NCG-HN199W/dp/B0FM3C4L2F/ref=sr_1_15
Electronics,LAPTOP,"HP 15, 13th Gen Intel Core i5-1334U, (16GB DDR4,512GB SSD) Anti-Glare, Micro-Edge, FHD, 15.6''/39.6cm, Win11, M365 Basic(1yr)* Office24, Silver, 1.59kg, fd0577TU, Iris Xe, FHD Camera w/Shutter Laptop",54990,3.8,2,https://www.amazon.in/HP-i5-1334U-Anti-Glare-Micro-Edge-fd0577TU/dp/B0F4R6H3NB/ref=sr_1_16
Electronics,LAPTOP,"Acer Aspire Lite, Intel Core i5 13th Gen - 1334U, 16GB RAM, 512GB SSD, Full HD 15.6""/39.62 cm, Windows 11 Home, MS Office, Steel Gray, 1.59 KG, AL15-53, Metal Body, Thin and Light Premium Laptop",44990,3.7,1,https://www.amazon.in/Acer-Aspire-Lite-Intel-Core/dp/B0DPXBHF8H/ref=sr_1_17
Electronics,LAPTOP,"ASUS Vivobook 15, Smartchoice,Intel Core i5 13th Gen 13420H,16GB RAM, 512GB SSD, FHD 15.6"",Windows 11, Office Home 2024, Quiet Blue, 1.70 kg, X1502VA-BQ836WS,Intel UHD iGPU, M365 Basic (1Year)* Laptop",56990,4.0,1,https://www.amazon.in/ASUS-Vivobook-i5-13420H-Keyboard-X1502VA-BQ836WS/dp/B0DTYKLHYC/ref=sr_1_18
Electronics,LAPTOP,"Cable World® Educational Laptop Computer Toy for Kids Above 3 Years - 20 Fun Activity Learning Machine, Now Learn Letter, Words, Games, Mathematics, Music, Logic, Memory Tool",699,3.8,2,https://www.amazon.in/Cable-Educational-Laptop-Computer-Kids/dp/B0FFYH9N2K/ref=sr_1_19
Electronics,LAPTOP,Ultimus APEX Pro Intel Pentium Quad Core Laptop 4GB RAM 128GB eMMC SSD Expandable~512GB Ultra Thin Bezel 180° Hinge 2.0x1 3.0x1 USB HDMI SD Card Slot ‎LPDDR4 Dual Speaker Win11 Home Cloud Silver 1.2Kg,12490,4.0,,https://www.amazon.in/Ultimus-Pentium-Expandable-512GB-%E2%80%8ELPDDR4-Speaker/dp/B0FKM5KW4R/ref=sr_1_20
Electronics,MOBILE PHONE,"Redmi 13 5G Prime Edition, Black Diamond, 8GB+128GB | India Debut SD 4 Gen 2 AE | 108MP Pro Grade Camera | 6.79in Largest Display in Segment",11199,4.1,5,https://www.amazon.in/Redmi-Diamond-Largest-Display-Segment/dp/B0D78Y577J/ref=sr_1_3
Electronics,MOBILE PHONE,"POCO M7 5G, Ocean Blue (6GB, 128GB)",8498,4.1,5,https://www.amazon.in/POCO-Ocean-Blue-6GB-128GB/dp/B0F135PGDX/ref=sr_1_4
Electronics,MOBILE PHONE,"Samsung Galaxy M06 5G (Blazing Black, 6GB RAM, 128 GB Storage) | MediaTek Dimensity 6300 | AnTuTu Score 422K+ | 12 5G Bands | 25W Fast Charging | 4 Gen of OS Upgrades | Without Charger",8999,3.9,5,https://www.amazon.in/Samsung-MediaTek-Dimensity-Charging-Upgrades/dp/B0DX5R87P8/ref=sr_1_5
Electronics,MOBILE PHONE,"Samsung Galaxy S24 FE 5G AI Smartphone (Graphite, 8GB RAM, 128GB Storage)",33999,4.3,5,https://www.amazon.in/Samsung-Galaxy-Smartphone-Graphite-Storage/dp/B0DHL7YT5S/ref=sr_1_6
Electronics,MOBILE PHONE,Redmi A5 Just Black (3GB RAM 64GB Storage) | Royale Design | Segment's Largest 17.47cm(6.88) and Smoothest 120Hz Display | 5200mAh Large Battery | Expandable Storage up to 2TB,6288,3.8,1,https://www.amazon.in/Redmi-Storage-Segments-Smoothest-Expandable/dp/B0F3P2ZL2X/ref=sr_1_7
Electronics,MOBILE PHONE,Redmi A3X Ocean Green 4GB RAM 128GB ROM,6779.,4.0,500,https://www.amazon.in/Redmi-Storage-Premium-Powerful-Processor/dp/B0D78VJQ93/ref=sr_1_8
Electronics,MOBILE PHONE,"(Refurbished) Oppo F31 Pro 5G (Space Grey, 8GB RAM, 256GB Storage)",24648,,,https://www.amazon.in/Refurbished-Oppo-Space-256GB-Storage/dp/B0FW4RP2G5/ref=sr_1_9
Electronics,MOBILE PHONE,"Samsung Galaxy A35 5G (Awesome Navy, 8GB RAM, 128GB Storage) Without Offer",17999,4.2,3,https://www.amazon.in/samsung-Galaxy-Awesome-Storage-Without/dp/B0CXMD9YX5/ref=sr_1_10
Electronics,MOBILE PHONE,XIAOMI 14 Civi Aqua Blue (12GB RAM 512GB Storage) | 50 MP Leica Triple Camera| SD 8s Gen 3 | 1.5K Quad Curved AMOLED HyperOS,29249,4.1,500,https://www.amazon.in/Xiaomi-Storage-Triple-Camera-HyperOS/dp/B0DW8DHZTM/ref=sr_1_13
Electronics,MOBILE PHONE,"Redmi 13 5G Prime Edition, Orchid Pink, 8GB+128GB | India Debut SD 4 Gen 2 AE | 108MP Pro Grade Camera | 6.79in Largest Display in Segment",11199,4.1,5,https://www.amazon.in/Redmi-Orchid-Largest-Display-Segment/dp/B0D78X5CMJ/ref=sr_1_14
Electronics,MOBILE PHONE,"Motorola G05 4G (Forest Green, 4+64)",7480,4.0,1,https://www.amazon.in/Motorola-Forest-Green-64GB-Storage/dp/B0DSTLPR3C/ref=sr_1_15
Electronics,MOBILE PHONE,"Motorola g45 5G (Pantone Moss, 128 GB) (8 GB RAM)",12290,4.0,2,https://www.amazon.in/Motorola-g45-Pantone-Moss-128/dp/B0FL21SZXQ/ref=sr_1_16
Electronics,MOBILE PHONE,"Redmi A4 5G (Starry Black, 4GB RAM, 128GB Storage) | Segment Largest 6.88in 120Hz | 50MP Dual Camera | 18W Fast Charging | Charger in The Box",8349,4.0,5,https://www.amazon.in/Redmi-A4-5G-Storage-Charging/dp/B0DLW4QD72/ref=sr_1_17
Electronics,MOBILE PHONE,Nothing Phone (3a) 5G (8GB RAM + 128GB Storage) (White),22668,4.4,1,https://www.amazon.in/Nothing-Phone-128GB-Storage-White/dp/B0DZTMFWDB/ref=sr_1_18
Electronics,MOBILE PHONE,"Samsung Galaxy M35 5G (DayBreak Blue,8GB RAM,128GB Storage)| Corning Gorilla Glass Victus+| AnTuTu Score 595K+| Vapour Cooling Chamber| 6000mAh Battery| 120Hz Super AMOLED Display| AI| Without Charger",18499,4.2,3,https://www.amazon.in/Samsung-Daybreak-Storage-Corning-Gorilla/dp/B0D7Z8FJZ9/ref=sr_1_19
Electronics,MOBILE PHONE,"realme NARZO 80 Lite 4G (Obsidian Black, 4GB+64GB) | 6300mAh Segment's Biggest Battery | 7.94mm Slim Design | 300% Ultra Volume | Pulse Light: 9 Colors, 5 Glow Modes | Ai Assist",6798,4.2,5,https://www.amazon.in/realme-Obsidian-6300mAh-Segments-Biggest/dp/B0FG2LPC6K/ref=sr_1_20
Electronics,HEADPHONES,"boAt 2025 Launch Rockerz 411, 40Ms Low Latency, 40Hrs Battery, 40Mm Drivers, ENx Tech, Stream Ad Free Music via App Support, Bluetooth Headphones, Wireless Over Ear Headphone with Mic (Active Black)",1099,4.2,5,https://www.amazon.in/boAt-Bluetooth-Headphones-Wireless-Headphone/dp/B0FC2Y8XYF/ref=sr_1_3
Electronics,HEADPHONES,"pTron Studio Evo 70hrs Playtime Wireless Over Ear Headphones with HD Mic, Low-Latency Game/Movie/Music Modes, Punchy Bass, BT5.3, Dual Device Pairing, Voice Assistant & Type-C Fast Charging (Blue)",799,4.1,500,https://www.amazon.in/pTron-Studio-Headphones-Low-Latency-Assistant/dp/B0FGV2CNN5/ref=sr_1_4
Electronics,HEADPHONES,"GOBOULT Newly Launched Fluid X Headphones Bluetooth Wireless with 60H Playtime, 40mm Bass Driver, Zen ENC Mic, Type-C Charging, Combat™Gaming Mode, BTv 5.4, Headphones Wireless with mic (Jet Black)",1999,4.0,2,https://www.amazon.in/Launched-Headphones-Bluetooth-Wireless-CombatTMGaming/dp/B0FNNB4C7B/ref=sr_1_5
Electronics,HEADPHONES,"boAt Rockerz 480, RGB LEDs,6 Light Modes, 40mm Drivers,Beast Mode, 60H Battery, ENx Tech, Stream Ad Free Music via App Support, Bluetooth Headphones, Wireless Over Ear Headphone with Mic (White Sabre)",1699,4.1,4,https://www.amazon.in/boAt-Rockerz-480-Bluetooth-Headphones/dp/B0DGTTKCJX/ref=sr_1_6
Electronics,HEADPHONES,"ZEBRONICS THUNDER Bluetooth 5.3 Wireless Headphones with 60H Backup, Gaming Mode, Dual Pairing, ENC, AUX, Micro SD, Voice assistant, Comfortable Earcups, Call Function(Black)",838.,3.8,3,https://www.amazon.in/ZEBRONICS-Bluetooth-Headphones-assistant-Comfortable/dp/B07L8KNP5F/ref=sr_1_7
Electronics,HEADPHONES,Boat BassHeads 100 in-Ear Headphones with Mic (Black),339,4.1,5,https://www.amazon.in/boAt-BassHeads-100-Headphones-Black/dp/B071Z8M4KX/ref=sr_1_8
Electronics,HEADPHONES,Acer Nitro Triple-Mode Gaming Headset | Bluetooth + 2.4GHz USB-C/USB-A Dongle + Wired | 50mm Drivers | 7.1 Virtual Surround | Running RGB | Low Latency <30ms | Flexible LED Mic | Windows/Android/iOS,3375,5.0,,https://www.amazon.in/Triple-Mode-Headset-Bluetooth-Surround-Flexible/dp/B0FR4KJ6NT/ref=sr_1_9
Electronics,HEADPHONES,"boAt Rockerz 450, 15 HRS Battery, 40mm Drivers, Padded Ear Cushions, Integrated Controls, Dual Modes, On Ear Bluetooth Headphones, Wireless Headphone with Mic (Luscious Black)",1399,4.0,4,https://www.amazon.in/Rockerz-450-Wireless-Bluetooth-Headphone/dp/B07PR1CL3S/ref=sr_1_10
Electronics,HEADPHONES,"Zebronics Zeb-Storm On Ear Wired Headphone with 3.5mm Jack, Built in Microphone for Calling, 1.5 Meter Cable, Soft Ear Cushion, Adjustable Headband, Foldable Ear Cups and Lightweight Design (Black)",523.,3.7,1,https://www.amazon.in/ZEBRONICS-Zeb-Storm-Microphone-Adjustable-Lightweight/dp/B0B4G44RFS/ref=sr_1_13
Electronics,HEADPHONES,"boAt 2025 Launch Rockerz 421, 40H Battery, Low Latency(40Ms), 40Mm Drivers, Enx Tech, Stream Ad Free Music via App Support, Bluetooth Headphones, Wireless Over Ear Headphone with Mic (Sage Green)",1399,4.2,500,https://www.amazon.in/boAt-Rockerz-Bluetooth-Headphones-Headphone/dp/B0F7LZ2GW2/ref=sr_1_14
Electronics,HEADPHONES,"Boat Rockerz 425 Bluetooth Wireless Over Ear Headphones with Mic Signature Sound, Beast Mode for Gaming, Enx Tech, ASAP Charge, 25H Playtime, Bluetooth V5.2 (Active Black)",1299,3.7,1,https://www.amazon.in/Rockerz-425-Bluetooth-Headphones-Signature/dp/B09QL3NQHX/ref=sr_1_15
Electronics,HEADPHONES,"Sony WH-CH520 Wireless Bluetooth Headphones On Ear with Mic, Up to 50Hrs Battery, Quick Charge, DSEE Upscale, Multipoint Connectivity, Voice Assistant, Customized EQ-Blue",3990,4.2,2,https://www.amazon.in/Sony-Bluetooth-Headphones-Multipoint-Connectivity/dp/B0BS1RT9S2/ref=sr_1_16
Electronics,HEADPHONES,"Boat Rockerz 430, 40mm Drivers, 40ms Latency, 40H Battery, ENx Tech, Adaptive Fit, Stream Ad Free Music via App Support, Bluetooth Headphones, Wireless Over Ear Headphone with Mic (Black Sabre)",1199,3.4,1,https://www.amazon.in/boAt-Rockerz-430-Assistant-Headphones/dp/B0DGTSTQWL/ref=sr_1_17
Electronics,HEADPHONES,"HP H200 On Ear Wireless Headset, Black",999,4.0,5,https://www.amazon.in/HP-99Y16AA-H200-Wireless-Headset/dp/B0DHKJ5HWL/ref=sr_1_18
Electronics,HEADPHONES,"boAt Rockerz 650 Pro (2025 Launch),Touch/Swipe Controls,Dolby Audio,80Hrs Battery,2Mics Enx,Fast Charge,App Support,Dual Pair,Bluetooth Over Ear Headphones,Wireless Headphone with Mic (Sage Green)",2999,4.2,1,https://www.amazon.in/boAt-Rockerz-650-Pro-Headphones/dp/B0DV5GLTLZ/ref=sr_1_19
Electronics,HEADPHONES,"ZEBRONICS Jet Premium Wired Gaming On Ear Headphone with LED Light for earcups, 40mm Neodymium Drivers, 2 Meter Braided Cable, Flexible mic, Suspension Headband, 3.5mm + USB Connector (Black + Blue)",775,3.9,1,https://www.amazon.in/ZEBRONICS-Headphone-Neodymium-Suspension-Controller/dp/B0B5RL2G3S/ref=sr_1_20
Electronics,KEYBOARD,ZEBRONICS ZEB-KM2100 Multimedia USB Keyboard Comes with 114 Keys Including 12 Dedicated Multimedia Keys & with Rupee Key,249,3.7,5,https://www.amazon.in/ZEBRONICS-ZEB-KM2100-Multimedia-Including-Dedicated/dp/B077T3BG5L/ref=sr_1_3
Electronics,KEYBOARD,"Dell KB216 Wired Multimedia Keyboard - Full-Size Layout with USB Interface, Chiclet Keys, Spill Resistance with 3 Indicator Lights| Plug and Play| Hot Keys: Volume, Mute, Play/Pause, Backward, Forward",569,4.3,3,https://www.amazon.in/Dell-KB216-Wired-Multimedia-Keyboard/dp/B00ZYLMQH0/ref=sr_1_4
Electronics,KEYBOARD,"EvoFox Fireblade TKL Semi-Mechanical Gaming Keyboard with Rainbow Backlit& Breathing Effect, Floating Keycaps, 19 Anti-Ghosting & 12 Multimedia Keys, Windows Lock Key, Braided Cable (Black)",799,4.0,1,https://www.amazon.in/AMKETTE-Amkette-Fireblade-Keyboard-Anti-Ghosting/dp/B085366TJW/ref=sr_1_5
Electronics,KEYBOARD,"Zebronics K24 Wired USB Keyboard, 104 Keys, Long Life 8 Million Keystrokes, Silent & Comfortable Use, Slim Design, Retractable Stand, 1.5 Meter Textured Cable, UV Coated keycaps",349,3.7,1,https://www.amazon.in/Zebronics-Keyboard-keystrokes-Comfortable-Retractable/dp/B0B29G5SSW/ref=sr_1_6
Electronics,KEYBOARD,HP K120 Wired Keyboard/3 Years RTB Warranty,599,4.0,4,https://www.amazon.in/HP-AB3C9AA-K120-Wired-Keyboard/dp/B0DXPHG886/ref=sr_1_7
Electronics,KEYBOARD,"FRONTECH Wired Mini Keyboard | Membrane Keys with Retractable Stands | USB Plug & Play | Ergonomic & Comfortable Design | 1 Year Warranty (KB-0041, Black)",299,3.9,500,https://www.amazon.in/FRONTECH-Retractable-Ergonomic-Comfortable-KB-0041/dp/B0CTMTKQWT/ref=sr_1_8
Electronics,KEYBOARD,"Ant Esports MK700 V2 Membrane TKL Wired Gaming Keyboard, 87 UV Coated Mechanical feel Keys Cool RGB Backlight Waterproof Keyboard for PC Laptop Mobile Tablets Gaming, Design and Work Mercury White",679,4.1,1,https://www.amazon.in/Ant-Esports-MK700-V2-Mechanical/dp/B0DFCW1ZNL/ref=sr_1_9
Electronics,KEYBOARD,"Keychron K10 Max Wireless Custom Mechanical Keyboard, 100% Layout QMK 2.4 GHz Bluetooth Wired White Backlit PBT Keycaps 108 Keys Compatible with Mac Windows Linux",27957,4.6,,https://www.amazon.in/Keychron-Wireless-Mechanical-Bluetooth-Compatible/dp/B0D62YM3J5/ref=sr_1_10
Electronics,KEYBOARD,"EvoFox Katana X2 TKL Mechanical Gaming Keyboard | 3‑Pin Replaceable Clicky Blue Switches, Dynamic Backlighting, All Keys Anti‑Ghosting, Volume Knob, Copilot, Xbox Gamebar, Screenshot & More (Black)",1649,4.2,1,https://www.amazon.in/EvoFox-Backlighting-Replaceable-Anti-Ghosting-Multifunction/dp/B0DDV1GWP7/ref=sr_1_13
Electronics,KEYBOARD,Build Your Dream Mechanical Keyboard: Customizable DIY Kit with Hot-Swappable Switches,,,,https://www.amazon.in/Lancemates-Build-Dream-Mechanical-Keyboard/dp/B0FN3Y217M/ref=sr_1_14
Electronics,KEYBOARD,"Logitech MK215 Wireless Keyboard and Mouse Combo, 2.4 GHz Wireless, 3 Years Warranty, Compact Design, 2-Year Battery Life(Keyboard),5 Month Battery Life(Mouse) PC/Laptop- Black",1169,4.0,4,https://www.amazon.in/Logitech-MK215-Wireless-Keyboard-Mouse/dp/B012MQS060/ref=sr_1_15
Electronics,KEYBOARD,Kreo Hive 65 RGB Anti-ghosting Gaming Keyboard | Wired Mechanical Keyboard with RGB Backlight | 5 Pin Hot-Swap | Detachable USB C Cable (Black),2899,4.5,500,https://www.amazon.in/Kreo-Anti-ghosting-Mechanical-Backlight-Detachable/dp/B0F4K8KZS8/ref=sr_1_16
Electronics,KEYBOARD,"Amkette New and Improved Optimus BT 4 in 1 Multi Device Wireless Keyboard/Bluetooth Keyboard | One Click Device Switching and AI Access for Windows, MacOs, Android and iOS, Dual OS Layout (Black)",879,3.9,400,https://www.amazon.in/Amkette-Wireless-Bluetooth-Connectivity-Multimedia/dp/B0D6G1TVWL/ref=sr_1_17
Electronics,KEYBOARD,"Ant Esports MK 1700 Wired Membrane Gaming Keyboard –with Backlit RGB LED, USB-A Connection, Quiet Keystrokes, 12 Multimedia Function Keys - for Computer, PC, Desktop, Gamer– 1 Year Warranty–Mercury",619,3.9,500,https://www.amazon.in/Ant-Esports-Connection-Keystrokes-Multimedia/dp/B0CLJHP3RF/ref=sr_1_18
Electronics,KEYBOARD,"Amkette New and Improved Optimus BT 4 in 1 Multi Device Wireless Keyboard/Bluetooth Keyboard | One Click Device Switching and AI Access for Windows, MacOs, Android and iOS, Dual OS Layout (White)",879,3.9,500,https://www.amazon.in/Amkette-Optimus-Bluetooth-Switching-White/dp/B0F2HRXTNV/ref=sr_1_19
Electronics,KEYBOARD,"Zebronics Wired Keyboard with 104 Keys, 1.2m Cable, ₹ Key, USB Interface, UV-Coated Keys, Retractable Stand, USB Nano Receiver, for PC, Laptop(K65, Black)",299,4.0,100,https://www.amazon.in/Zebronics-Keyboard-Interface-UV-Coated-Retractable/dp/B0FPQYK3D7/ref=sr_1_20
Electronics,MOUSE,"Zebronics Zeb-Comfort Wired USB Mouse, 3-Button, 1000 DPI Optical Sensor, Plug & Play, for Windows/Mac, Black",109,3.9,5,https://www.amazon.in/ZEBRONICS-Zeb-Comfort-3-Button-Optical-Windows/dp/B079Y6JZC8/ref=sr_1_3
Electronics,MOUSE,"Portronics Toad 101 Wired Optical Mouse with 1200 DPI, Plug & Play, Hi-Optical Tracking, 1.25M Cable Length, 30Lakhs Click Life(Black)",119,4.1,4,https://www.amazon.in/Portronics-Optical-Hi-Optical-Tracking-Million/dp/B0BRKSQ7Z2/ref=sr_1_4
Electronics,MOUSE,"Dell MS116 Wired Optical Mouse - High Precision 1000DPI Sensor, USB Connectivity, Ergonomic Ambidextrous Design, Smooth Scrolling, Ideal for Office & Home Use - Black",309,4.4,5,https://www.amazon.in/Dell-MS116-1000DPI-Wired-Optical/dp/B01HJI0FS2/ref=sr_1_5
Electronics,MOUSE,"ZEBRONICS PHERO Wired Gaming Mouse with up to 1600 DPI, Rainbow LED Lights, DPI Switch, High Precision, Plug & Play, 4 Buttons",199,4.0,2,https://www.amazon.in/ZEBRONICS-Gaming-Rainbow-Precision-Buttons/dp/B0CG13FJ5M/ref=sr_1_6
Electronics,MOUSE,"Redgear A-10 Wired Gaming Mouse with RGB LED, Lightweight and Durable Design, DPI Upto 2400, Compatible with Windows.",172.,4.3,1,https://www.amazon.in/Redgear-Gaming-Mouse-Upto-2400/dp/B08372ZPVS/ref=sr_1_7
Electronics,MOUSE,EvoFox Starter Series Spectre USB Wired Gaming Mouse | Upto 3600 DPI Gaming Sensor | 6 Buttons | Upto 7 Million Clicks | 7 Colours Rainbow Lighting with Breathing Effect | 1.5m Braided Cable (White),379,4.4,1,https://www.amazon.in/EvoFox-Spectre-Lighting-Breathing-White/dp/B0DGVH47HW/ref=sr_1_8
Electronics,MOUSE,"Portronics Toad One Bluetooth Mouse with 2.4 GHz & BT 5.3 Dual Wireless, 6 Buttons, Rechargeable, RGB Lights, Connect 3 Devices, Ergonomic Design for Laptop, Smartphone, Tablet (Black)",549,4.3,5,https://www.amazon.in/Portronics-Wireless-Bluetooth-Connectivity-Rechargeable/dp/B0BG8LZNYL/ref=sr_1_9
Electronics,MOUSE,"ZEBRONICS Blanc Slim Wireless Mouse with Rechargeable Battery, BT + 2.4GHz, 4 Buttons, 800/1200/1600 DPI, Silent Operation, Multicolor LED Lights",392,4.0,5,https://www.amazon.in/ZEBRONICS-Launched-Rechargeable-Operation-Multicolor/dp/B0CQRNWJM2/ref=sr_1_10
Electronics,MOUSE,"Logitech M186 Wireless Mouse, 2.4GHz with USB Mini Receiver, 12-Month Battery Life, 1000 DPI Optical Tracking, Ambidextrous, Compatible with PC, Mac, Laptop",495,4.1,5,https://www.amazon.in/Logitech-Wireless-Receiver-Ambidextrous-Compatible/dp/B0D18192T2/ref=sr_1_13
Electronics,MOUSE,EvoFox Blaze Ultra Value 8 Button Programmable Gaming Mouse with 1000Hz Polling Rate | Gaming Grade DPI 200 to 12800 | Ultra-Responsive 7000fps | RGB Lights with Music sync Mode | Windows Software,583,4.4,1,https://www.amazon.in/EvoFox-Blaze-Programmable-Ultra-Responsive-Sensitive/dp/B0D66VB4TH/ref=sr_1_14
Electronics,MOUSE,"Arctic Fox Pureview Transparent Wireless and Bluetooth Rechargeable Mouse, USB Receiver,LED Battery Magic Silm for Office/PC/Mac/Laptop/Apple/ipad(Space Gray)",649,4.4,4,https://www.amazon.in/Arctic-Fox-Transparent-Bluetooth-Rechargeable/dp/B0CP9NSXYJ/ref=sr_1_15
Electronics,MOUSE,EvoFox Starter Series Spectre USB Wired Gaming Mouse with Upto 3600 DPI Gaming Sensor | 6 Buttons Design | Upto 7 Million Clicks | 7 Colours Rainbow Lighting with Breathing Effect | 1.5m Braided Cable (Black),379,4.4,2,https://www.amazon.in/EvoFox-Spectre-Buttons-Lighting-Breathing/dp/B0CNQ75PC8/ref=sr_1_16
Electronics,MOUSE,"Zebronics Zeb-Power Wired USB Mouse, 3-Button, 1200 DPI Optical Sensor, Plug & Play, for Windows/Mac",117,3.9,500,https://www.amazon.in/Zebronics-Zeb-Power-Wired-Mouse-Black/dp/B07L9FW9GF/ref=sr_1_17
Electronics,MOUSE,HP M190 Wireless Mouse (AB3C6AA),422,3.6,5,https://www.amazon.in/HP-M190-Wireless-Mouse-AB3C6AA/dp/B0DXNTYWHV/ref=sr_1_18
Electronics,MOUSE,"Portronics Toad 23 Wireless Optical Mouse with 2.4GHz, USB Nano Dongle, Optical Orientation, Click Wheel, Adjustable DPI(Black)",299,4.0,5,https://www.amazon.in/Portronics-Wireless-Optical-Orientation-Adjustable/dp/B0B296NTFV/ref=sr_1_19
Electronics,MOUSE,"Portronics Toad 34 Wireless Mouse with 2.4 GHz Wireless, Adjustable Sensitivity, USB Receiver, Ergonomic Design, for Laptops, Desktops PC, Mac (Grey)",269,4.0,500,https://www.amazon.in/Portronics-Wireless-Adjustable-Sensitivity-Ergonomic/dp/B0DGGW7FFS/ref=sr_1_20
Electronics,MONITOR,"FRONTECH 20 Inch (50.8 cm), LED, HD 1600 x 900, 60Hz, Black, 16.7M Colors, Wall Mountable, Slim & Stylish Design, HDMI, VGA, Built-in Power Supply Monitor (MON-0054)",2839,3.4,3,https://www.amazon.in/FRONTECH-Monitor-Refresh-Mountable-MON-0054/dp/B0C5RWGPF7/ref=sr_1_3
Electronics,MONITOR,"ZEBRONICS Zeb-V19Hd 18.5 Inch (46.99 Cm) Led Monitor with Supporting Hdmi, Vga Input, Hd 1366 X 768 Pixels, 16.7M Colors, Glossy Panel, Slim Design & Wall Mountable, Black",2699,3.6,1,https://www.amazon.in/ZEBRONICS-ZEB-V19HD-LED-Supporting-Mountable/dp/B09GG4FT99/ref=sr_1_4
Electronics,MONITOR,"Acer EK220Q 21.5 Inch (54.61 cm) Full HD (1920x1080) Pixels VA Panel LCD Monitor with LED Back Light I 1 MS VRB, 100Hz Refresh I 250 Nits I HDMI & VGA Ports with HDMI Cable I Eye Care Features (Black)",5695,4.3,1,https://www.amazon.in/Acer-1920x1080-Monitor-Refresh-Features/dp/B0BXP3CP9K/ref=sr_1_5
Electronics,MONITOR,"Samsung 24"" (60.5 cm) S3 Flat Monitor|Super Slim Borderless Design|IPS Panel|FHD 1920 x 1080|100 Hz|5 ms|Ports-HDMI,VGA|Game Mode|Eye Saver Mode||Wall Mountable|LS24D300GAWXXL|Black",7499,4.2,1,https://www.amazon.in/Samsung-Essential-Monitor-Resolution-LS24D300GAWXXL/dp/B0DQ57M7MD/ref=sr_1_6
Electronics,MONITOR,"FRONTECH 22-inch, LED, HD 1680x1050, 60Hz, Black, Wall Mountable Slim & Stylish Design, 16.7M Colors, HDMI & VGA Ports, Built-in Power Supply Monitor (MON-0060)",3499,3.4,1,https://www.amazon.in/FRONTECH-22-inch-1680x1050-Mountable-MON-0060/dp/B0CBTQZ63V/ref=sr_1_7
Electronics,MONITOR,"MSI PRO MP223 E2, 21.45 Inch (54.48 cm), Full HD 1920 x 1080, 100Hz, Black, Eye-Friendly Screen, Tilt-Adjustable, HDMI 1.4b, DisplayPort 1.2a Monitor",5699,4.6,500,https://www.amazon.in/MSI-MP223-E2-21-45-Inch-Monitor/dp/B0DFHJ8KYJ/ref=sr_1_8
Electronics,MONITOR,"ZEBRONICS EA124 LED Monitor, 24 inch (60.4cm), 250 nits, 100Hz, FHD, 1920x1080, HDMI, VGA, Ultra Slim Bezel, Built-in Speakers, Metal Stand, Wall Mountable",6499,3.8,500,https://www.amazon.in/ZEBRONICS-Monitor-1920x1080-Speakers-Mountable/dp/B0D2TFGBGS/ref=sr_1_9
Electronics,MONITOR,"ZEBRONICS V22HD+LED, 22 Inch (55.8cm) LED Monitor, Dual HDMI & VGA Input, HD+1680 x 1050, 220nits Brightness, 5000000:1 Dynamic Contrast Ratio, 16.7M Colors,16:10 Aspect Ratio, Wall Mountable",3999,3.5,1,https://www.amazon.in/ZEBRONICS-LED-Monitor-220nits-Brightness/dp/B0F99TS8M6/ref=sr_1_10
Electronics,MONITOR,"LG Ultragear™ 32GS60QC, 32 inch (81.28 cm), QHD 2560 x 1440 1000R Curved, 180Hz, Black, 1ms, AMD FreeSync™, HDR10, VESA Certified, HDMIx2 DisplayPort, 3-Side virtually Borderless Gaming Monitor",19649,4.3,400,https://www.amazon.in/LG-UltragearTM-FreeSyncTM-DisplayPort-Borderless/dp/B0DCBDVNLD/ref=sr_1_13
Electronics,MONITOR,"Lenovo Legion R25f-30, 25 Inch (63.50cm), FHD 1920x1080, 240Hz, Black, 0.5ms, AMD FreeSync, 99% sRGB, 90% DCI-P3, 3Wx2 Speaker, 2xHDMI, 1xDP, Tilt, Swivel, Pivot, Height Adjust Stand Gaming Monitor",12199,4.4,200,https://www.amazon.in/Lenovo-Legion-R25f-30-63-50cm-FreeSync-67B8GACBIN/dp/B0CV4CTTY1/ref=sr_1_14
